Overheidsinstantie,Titel,Locatie,Wettelijke grondslag,Aantal beschikkingen,Soorten beschikkingen,Integraal of register,Periode,Aanwezige metadata (filters),Laatste update,Type
"ministerie van Sociale Zaken en Werkgelegenheid",Verleende beschikkingen,https://www.uitvoeringvanbeleidszw.nl/documenten?trefwoord=&startdatum=&einddatum=&subsidie-en-regeling=Alle+subsidies+en+regelingen&type=Verleende+beschikking,Wet open overheid,327,subsidie,integraal,2014-2018,"Periode, onderwerp, type",2026-02-07,ministerie
ministerie van Algemene Zaken,Beschikking - Besluit,https://open.overheid.nl/,Wet open overheid,9,benoeming,integraal,2025,"thema, datum beschikbaar",2026-02-17,ministerie
ministerie van Binnenlandse Zaken en Koninkrijksrelaties,Beschikking - Besluit,https://open.overheid.nl/,Wet open overheid,1,benoeming,integraal,2025,"thema, datum beschikbaar",2026-02-17,ministerie
ministerie van Defensie,Vergunning,https://open.overheid.nl/,Wet open overheid,1,vergunning,integraal,2021,"thema, datum beschikbaar",2026-02-17,ministerie
ministerie van Defensie,Beschikking - Besluit,https://open.overheid.nl/,Wet open overheid,1,benoeming,integraal,2025,"thema, datum beschikbaar",2026-02-17,ministerie
ministerie van Economische Zaken,Vergunning,https://open.overheid.nl/,Wet open overheid,77,vergunning,integraal,2010-2015,"thema, datum beschikbaar",2026-02-17,ministerie
ministerie van Economische Zaken,Beschikking - Besluit,https://open.overheid.nl/,Algemene Groepsvrijstellingsverordening,35,subsidie,integraal,2024-2025,"thema, datum beschikbaar",2026-02-17,ministerie
"ministerie van Financiën",Beschikking - Besluit,https://open.overheid.nl/,Wet open overheid,1,goedkeuring,integraal,2025,"thema, datum beschikbaar",2026-02-17,ministerie
ministerie van Infrastructuur en Waterstaat,Vergunning,https://open.overheid.nl/,Wet open overheid,17,vergunning,integraal,2011-2020,"thema, datum beschikbaar",2026-02-17,ministerie
ministerie van Infrastructuur en Waterstaat,Beschikking - Besluit,https://open.overheid.nl/,Algemene Groepsvrijstellingsverordening,3,subsidie,integraal,2025,"thema, datum beschikbaar",2026-02-17,ministerie
ministerie van Klimaat en Groene Groei,Beschikking - Besluit,https://open.overheid.nl/,Algemene Groepsvrijstellingsverordening,6,subsidie,integraal,2025,"thema, datum beschikbaar",2026-02-17,ministerie
"ministerie van Landbouw, Visserij, Voedselzekerheid en Natuur",Natuurvergunningen,https://puc.overheid.nl/natuurvergunningen/,Wet open overheid,761,vergunning; handhaving,integraal,2006-2025,"onderwerp, thema, datum document, datum beschikbaarheid, organisatie",2026-02-17,ministerie
"ministerie van Landbouw, Visserij, Voedselzekerheid en Natuur",Vergunning,https://open.overheid.nl/,Wet open overheid,2,vergunning,integraal,2021,"thema, datum beschikbaar",2026-02-17,ministerie
"ministerie van Landbouw, Visserij, Voedselzekerheid en Natuur",Beschikking - Besluit,https://open.overheid.nl/,Algemene Groepsvrijstellingsverordening,16,subsidie,integraal,2025,"thema, datum beschikbaar",2026-02-17,ministerie
"ministerie van Onderwijs, Cultuur en Wetenschap",Beschikking - Besluit,https://open.overheid.nl/,Algemene Groepsvrijstellingsverordening,9,"subsidie, instemming",integraal,2025,"thema, datum beschikbaar",2026-02-17,ministerie
"ministerie van Volksgezondheid, Welzijn en Sport",Vergunning,https://open.overheid.nl/,Wet open overheid,15,vergunning,integraal,2013-2022,"thema, datum beschikbaar",2026-02-17,ministerie
ministerie van Volkshuisvesting en Ruimtelijke Ordening,Beschikking - Besluit,https://open.overheid.nl/,Algemene Groepsvrijstellingsverordening,1,subsidie,integraal,2025,"thema, datum beschikbaar",2026-02-17,ministerie
Inspectie Leefomgeving en Transport (ILT),Beschikking,https://www.ilent.nl/documenten,Wet open overheid,5,last onder bestuursdwang/dwangsom; verklaring van geen bezwaar,integraal,2017-2025,"Periode, onderwerp, type",2026-02-07,dienst
Inspectie van het Onderwijs (IvhO),Toezichtsoordelen,https://toezichtresultaten.onderwijsinspectie.nl/,Wet op het onderwijstoezicht,60,toezichtsoordeel 'zeer zwak',integraal,nnb,,2026-02-07,dienst
Justis (Screeningsautoriteit),,https://justis.nl/registers/woo-publicaties,,,,,,,,dienst
Nederlandse Voedsel- en Warenautoriteit (NVWA),Besluit,https://www.nvwa.nl/documenten,Wet open overheid,121,openbaarmakingsbesluit/informatiebeschikking,integraal,2021-2025,"Periode, onderwerp, type",2026-02-07,dienst
Rijksdienst voor Ondernemend Nederland (RVO),Projecten,https://projecten.rvo.nl/nl,Wet open overheid,,subsidies,register,2020-2025,Jaar,2026-02-07,dienst
Rijksdienst voor Ondernemend Nederland (RVO),Maatwerkbeschikkingen,https://www.rvo.nl/onderwerpen/maatwerkbeschikkingen#beschikkingen,Algemene Groepsvrijstellingsverordening,47,subsidies,integraal,2020-2025,Jaar,2026-02-17,dienst
Rijksinspectie Digitale Infrastructuur (RDI),Besluit,https://www.rdi.nl/documenten,Wet open overheid,5,bestuurlijke boete,integraal,2019-2025,"Periode, onderwerp, type",2026-02-07,dienst
Rijksinspectie Digitale Infrastructuur (RDI),Vergunningen,https://www.rdi.nl/documenten,Wet open overheid,99,vergunning,register,2019-2025,"periode, type",2026-02-18,dienst
Autoriteit Consument en Markt (ACM),Publicaties,https://www.acm.nl/nl/publicaties,Instellingswet Autoriteit Consument en Markt,4476,besluit; beslissing op bezwaar,integraal,2014-2025,"soort; onderwerp, publicatietype; jaar; onderwerp",2025-10-31,zbo
Stichting Autoriteit Financiële Markten (AFM),Maatregelen,https://www.afm.nl/nl-nl/sector/actueel?filter=maatregel,Wet op het financieel toezicht,107,sanctie; aanwijzing,integraal,2016-2025,onderwerp,2026-02-17,zbo
Autoriteit Nucleaire Veiligheid en Stralingsbescherming (ANVS),Besluiten,https://puc.overheid.nl/anvs/zoeken/resultaat/t/0/s/issued-wt_desc/inf/besluiten/gdlv/1/b/0/,Wet open overheid,11367,vergunning; registratiebesluit,integraal,2002-2025,geldigheid; onderwerp; informatietype; documentsoort; organisatie; datum document; vergunninghouder; datum beschikbaarheid,2026-02-17,zbo
Autoriteit Persoonsgegevens (AP),Besluiten,https://www.autoriteitpersoonsgegevens.nl/documenten?document_type%5B0%5D=4,Wet open overheid,254,"vergunning; Woo-besluit; besluit op bezwaar; sanctiebesluit; besluit gedragscode/verklaringsbeschikking",integraal,2018-2025,zoekterm; soort besluit; onderwerp; periode,2026-02-18,zbo
Centraal Bureau Rijvaardigheidsbewijzen (CBR),Beschikkingen,https://www.cbr.nl/nl/over-het-cbr/over/open-overheid/publicaties-zonder-verzoek,Wet open overheid,39,(her)benoeming,integraal,2024,,2026-02-18,zbo
"College ter Beoordeling van Geneesmiddelen (CBG)",Handelsvergunningen,"https://www.geneesmiddeleninformatiebank.nl/ords/f?p=111:1:0::NO:1:P0_DOMAIN,P0_LANG:H,NL",Geneesmiddelenwet,,vergunning,register,2015-2025,Naam geneesmiddel; Productnaam; Werkzame stof (inclusief synoniemen); Hulpstof (inclusief synoniemen); Bevat geen; Farmaceutische vorm; Toedieningsweg; Afleverstatus; Registratienummer; EU-nummer (Europees registratienummer); EU-nummer; Datum verstrekking handelsvergunning; Datum verstrekking handelsvergunning: (dd-mm-jjjj); Handelsvergunninghouder; Aanvullende monitoring; Additioneel risicominimalisatie materiaal,2026-02-10,zbo
"College van toezicht collectieve beheersorganisaties auteurs- en naburige rechten (CvTA)",Besluiten,https://www.cvta.nl/documentatie/?_documentation_type=besluiten,Wet open overheid,226,"varia (instemming, handhaving)",integraal,2016-2025,jaar; organisatie,2026-02-10,zbo
College voor de toelating van gewasbeschermingsmiddelen en biociden (Ctgb),Toelatingen,https://toelatingen.ctgb.nl/nl/authorisations,,2888,vergunning,register/integraal,2005-2025,categorie; status; gebruikers; werkzame stoffen; toelatingshouders; expiratie; ingangsdatum; toepassingsinfo; doelorganismen(2x); productypes; beschermstoffen; aard werking; toepassingslocaties; toelatingstype,2026-02-18,zbo
De Nederlandsche Bank (DNB),Handhavingsmaatregelen,https://www.dnb.nl/zoekresultaten/?p=1&l=10&it=MjY3MDE,Wet op het financieel toezicht,158,bestuurlijke boete; last onder dwangsom; aanwijzing; wijzigingsbeschikking/intrekking vergunning,integraal,2012-2025,Onderwerp; Onderwerp voor de sector; Sector; Auteur; Jaar,2026-02-17,zbo
Kansspelautoriteit (Ksa),Sanctiebesluiten,https://kansspelautoriteit.nl/sanctiebesluiten,Wet open overheid,529,sanctiebesluiten,integraal,2014-2025,,2025-10-20,zbo
Kansspelautoriteit (Ksa),Vergunningen,https://kansspelautoriteit.nl/kansspelwijzer,Wet open overheid,507,exploitatie speelautomaat,register,nnb,,2025-12-31,zbo
Kansspelautoriteit (Ksa),Vergunningen,https://kansspelautoriteit.nl/kansspelwijzer,Wet open overheid,51,vergunningen,integraal,nnb,,2025-12-31,zbo
Nederlands-Vlaamse Accreditatieorganisatie (NVAO),Accreditaties,https://besluitenrapporten.nvao.net/,Wet open overheid,7217,accreditatie,register/integraal,2011-2025,,,zbo
Nederlandse organisatie voor Wetenschappelijk Onderzoek (NWO),Kennisgevingen steunmaatregelen,https://www.nwo.nl/kennisgevingen-steunmaatregelen,Algemene Groepsvrijstellingsverordening,8,subsidie,integraal,2023-2025,,2026-02-07,zbo
Nederlandse Zorgautoriteit (NZa),Besluit,https://puc.overheid.nl/nza/,Wet open overheid,2752,Beslissing aanmerkelijke marktmacht; Beslissing op bezwaar; Fusiebesluit; Handhavingsbesluit; Intrekkingsbesluit,integraal,2020-2025,,,zbo
Stichting Nederlands Fonds voor de Film (Nederlands Filmfonds),,https://www.filmfonds.nl/toegewezen-bijdragen,,,,,,,,,zbo
